{
  "export_id": "AXPK-ACTION-0001",
  "source_action_packet_id": "AP-ACTION-0001",
  "source_receipt_id": "WDR-ACTION-0001",
  "source_summary_id": "DS-REVIEW-0003",
  "source_intake_id": "IR-REVIEW-0003",
  "source_item_ids": ["QA-SEC-0001", "QA-SEC-0002"],
  "source_evidence_ids": ["EP-SECURITY-001", "QR-SEC-001"],
  "action_state": "proposed",
  "decision": "accepted_for_action",
  "rationale": "Security findings accepted for action. Export created for engineering team handoff.",
  "exported_at": "2026-07-08T03:00:00Z",
  "authority_disclaimer": "This action packet export packages the intended action path for downstream handoff only. It does not execute work, authorize execution, approve intake, verify evidence, close workbench items, mutate packets, mutate source records, seal anything, or create autonomous authority. Custody is qa-pilot-local. Librarian impact is none.",
  "custody": "qa-pilot-local",
  "advisory_only": true,
  "librarian_impact": "none"
}
